Station Name,Time/Day,Height,Tendency,Crossing,Flood Class,Recent Data,Scraped,State
Lagoon Ck at Moodlu (Williams Rd) #,11.38pm Thu,0.00,rising,,,Plot | Table,2022-10-14 00:50:02.239805+11:00,QLD
Lagoon Ck at Machinery Pde #,9.10pm Thu,0.20,steady,,,Plot | Table,2022-10-14 00:50:02.239805+11:00,QLD
King John Ck at Beerburrum Rd *,5.25pm Thu,-2.70^,steady,,,Plot | Table,2022-10-14 00:50:02.239805+11:00,QLD
King John Ck at Pumicestone Rd #,10.12pm Thu,0.00,steady,,,Plot | Table,2022-10-14 00:50:02.239805+11:00,QLD
King Johns Ck at Bribie Is Rd #,9.15pm Thu,0.33,steady,,,Plot | Table,2022-10-14 00:50:02.239805+11:00,QLD
Caboolture R at Riversleigh Rd #,11.34pm Thu,1.61,rising,,,Plot | Table,2022-10-14 00:50:02.239805+11:00,QLD
Caboolture R at St Smith Rd AL#,10.58pm Thu,0.54,rising,,,Plot | Table,2022-10-14 00:50:02.239805+11:00,QLD
Beachmere #,9.33pm Thu,0.55,steady,,,Plot | Table,2022-10-14 00:50:02.239805+11:00,QLD
Elimbah Ck at Donnybrook Rd #,11.36pm Thu,0.71,rising,,,Plot | Table,2022-10-14 00:50:02.239805+11:00,QLD
