Station Name,Time/Day,Height,Tendency,Crossing,Flood Class,Recent Data,Scraped,State
Lagoon Ck at Machinery Pde #,6.10pm Thu,0.20,steady,,,Plot | Table,2022-10-13 22:20:01.795332+11:00,QLD
King John Ck at Beerburrum Rd *,5.25pm Thu,-2.70^,steady,,,Plot | Table,2022-10-13 22:20:01.795332+11:00,QLD
King John Ck at Pumicestone Rd #,7.12pm Thu,0.00,steady,,,Plot | Table,2022-10-13 22:20:01.795332+11:00,QLD
King Johns Ck at Bribie Is Rd #,6.15pm Thu,0.33,steady,,,Plot | Table,2022-10-13 22:20:01.795332+11:00,QLD
Caboolture R at Riversleigh Rd #,9.02pm Thu,0.96,rising,,,Plot | Table,2022-10-13 22:20:01.795332+11:00,QLD
Caboolture R at St Smith Rd AL#,8.58pm Thu,0.09,rising,,,Plot | Table,2022-10-13 22:20:01.795332+11:00,QLD
Beachmere #,8.54pm Thu,0.55,falling,,,Plot | Table,2022-10-13 22:20:01.795332+11:00,QLD
Elimbah Ck at Donnybrook Rd #,8.00pm Thu,0.16,falling,,,Plot | Table,2022-10-13 22:20:01.795332+11:00,QLD
