Station Name,Time/Day,Height,Tendency,Crossing,Flood Class,Recent Data,Scraped,State
Lagoon Ck at Machinery Pde #,12.10pm Thu,0.20,steady,,,Plot | Table,2022-10-13 16:19:08.589421+11:00,QLD
King John Ck at Beerburrum Rd *,1.10pm Thu,-2.70^,steady,,,Plot | Table,2022-10-13 16:19:08.589421+11:00,QLD
King John Ck at Pumicestone Rd #,1.12pm Thu,0.00,steady,,,Plot | Table,2022-10-13 16:19:08.589421+11:00,QLD
King Johns Ck at Bribie Is Rd #,12.15pm Thu,0.33,steady,,,Plot | Table,2022-10-13 16:19:08.589421+11:00,QLD
Caboolture R at Riversleigh Rd #,3.00pm Thu,1.16,falling,,,Plot | Table,2022-10-13 16:19:08.589421+11:00,QLD
Caboolture R at St Smith Rd AL#,3.03pm Thu,0.04,falling,,,Plot | Table,2022-10-13 16:19:08.589421+11:00,QLD
Beachmere #,2.11pm Thu,0.60,rising,,,Plot | Table,2022-10-13 16:19:08.589421+11:00,QLD
Elimbah Ck at Donnybrook Rd #,3.09pm Thu,0.96,falling,,,Plot | Table,2022-10-13 16:19:08.589421+11:00,QLD
