Station Name,Time/Day,Height,Tendency,Flood Class,Recent Data,Scraped,State
Tweed River,Tweed River,Tweed River,Tweed River,Tweed River,Tweed River,2022-10-14 14:10:02.390794+11:00,NSW
Tyalgum Bridge,1.25pm Fri,0.83,steady,,Plot | Table,2022-10-14 14:10:02.390794+11:00,NSW
Clarrie Hall Dam (mAHD),1.10pm Fri,61.51^,steady,,Plot | Table,2022-10-14 14:10:02.390794+11:00,NSW
Clarrie Hall Dam D/S,1.12pm Fri,0.53,steady,,Plot | Table,2022-10-14 14:10:02.390794+11:00,NSW
Tweed R at Palmers Road,1.41pm Fri,0.72,steady,,Plot | Table,2022-10-14 14:10:02.390794+11:00,NSW
Tweed R at Uki,1.00pm Fri,1.22,steady,,Plot | Table,2022-10-14 14:10:02.390794+11:00,NSW
Oxley R at Eungella,1.01pm Fri,0.56,steady,,Plot | Table,2022-10-14 14:10:02.390794+11:00,NSW
Tweed R at Bray Park Weir (mAHD),11.17am Fri,1.13^,steady,,Plot | Table,2022-10-14 14:10:02.390794+11:00,NSW
Tweed R at Murwillumbah Br (mAHD),1.44pm Fri,0.74^,steady,,Plot | Table,2022-10-14 14:10:02.390794+11:00,NSW
Tweed R at Murwillumbah (mAHD),1.34pm Fri,0.71^,steady,below minor,Plot | Table,2022-10-14 14:10:02.390794+11:00,NSW
Rous R at Chillingham,9.46am Fri,0.98,steady,,Plot | Table,2022-10-14 14:10:02.390794+11:00,NSW
Rous R at Boat Harbour,1.44pm Fri,0.65,steady,,Plot | Table,2022-10-14 14:10:02.390794+11:00,NSW
Rous R at Boat Harbour (Nobbys Ck),1.00pm Fri,0.85,steady,,Plot | Table,2022-10-14 14:10:02.390794+11:00,NSW
Rouse R at Kynnumboon,1.44pm Fri,0.67^,steady,,Plot | Table,2022-10-14 14:10:02.390794+11:00,NSW
Tweed R at Tumbulgum,1.35pm Fri,0.67^,steady,below minor,Plot | Table,2022-10-14 14:10:02.390794+11:00,NSW
Tweed R at Chindera (mAHD),1.43pm Fri,0.47^,steady,below minor,Plot | Table,2022-10-14 14:10:02.390794+11:00,NSW
Tweed R at Barneys Point,1.15pm Fri,1.47,steady,below minor,Plot | Table,2022-10-14 14:10:02.390794+11:00,NSW
Tweed R at Dry Dock (mAHD),1.30pm Fri,0.52^,steady,,Plot | Table,2022-10-14 14:10:02.390794+11:00,NSW
Tweed Coastal Creeks,Tweed Coastal Creeks,Tweed Coastal Creeks,Tweed Coastal Creeks,Tweed Coastal Creeks,Tweed Coastal Creeks,2022-10-14 14:10:02.390794+11:00,NSW
Cudgen Ck at Kingscliff,1.16pm Fri,0.61,falling,,Plot | Table,2022-10-14 14:10:02.390794+11:00,NSW
Cudgen Lake at Bogangar,1.15pm Fri,0.40,steady,,Plot | Table,2022-10-14 14:10:02.390794+11:00,NSW
Burringbar Ck at Tweed Valley Way,1.00pm Fri,0.68,steady,,Plot | Table,2022-10-14 14:10:02.390794+11:00,NSW
Crabbes Ck at Crabbes Creek,10.46am Fri,0.91,steady,,Plot | Table,2022-10-14 14:10:02.390794+11:00,NSW
Crabbes Ck at Wooyung Road,1.18pm Fri,1.25,steady,,Plot | Table,2022-10-14 14:10:02.390794+11:00,NSW
Brunswick River,Brunswick River,Brunswick River,Brunswick River,Brunswick River,Brunswick River,2022-10-14 14:10:02.390794+11:00,NSW
Yelgun Ck at Yelgun,11.32am Fri,2.21,steady,,Plot | Table,2022-10-14 14:10:02.390794+11:00,NSW
Yelgun Ck at Helen St Bridge,1.37pm Fri,0.47,rising,,Plot | Table,2022-10-14 14:10:02.390794+11:00,NSW
Marshalls Ck at The Pocket,1.44pm Fri,0.89,steady,,Plot | Table,2022-10-14 14:10:02.390794+11:00,NSW
Lacks Ck at Middle Pocket,10.57am Fri,2.23,steady,,Plot | Table,2022-10-14 14:10:02.390794+11:00,NSW
Marshalls Ck at Billinudgel,1.35pm Fri,0.28,steady,below minor,Plot | Table,2022-10-14 14:10:02.390794+11:00,NSW
Marshalls Ck at Ocean Shores,1.16pm Fri,0.67,falling,,Plot | Table,2022-10-14 14:10:02.390794+11:00,NSW
Brunswick R at Sherrys Br,12.28pm Fri,0.69,steady,,Plot | Table,2022-10-14 14:10:02.390794+11:00,NSW
Mullumbimby Ck at Mullumbimby Creek,1.41pm Fri,0.30,steady,,Plot | Table,2022-10-14 14:10:02.390794+11:00,NSW
Mullumbimby Ck at Azalea St Bridge,1.43pm Fri,0.74,steady,,Plot | Table,2022-10-14 14:10:02.390794+11:00,NSW
Brunswick R at Mullumbimby,1.43pm Fri,0.68^,steady,below minor,Plot | Table,2022-10-14 14:10:02.390794+11:00,NSW
Brunswick R at Brunswick Heads,1.16pm Fri,0.66,falling,,Plot | Table,2022-10-14 14:10:02.390794+11:00,NSW
Byron Bay (Tallow Ck Br),1.44pm Fri,1.40,steady,,Plot | Table,2022-10-14 14:10:02.390794+11:00,NSW
Byron Bay (Belongil Ck Br),1.35pm Fri,0.85,steady,,Plot | Table,2022-10-14 14:10:02.390794+11:00,NSW
Wilsons River,Wilsons River,Wilsons River,Wilsons River,Wilsons River,Wilsons River,2022-10-14 14:10:02.390794+11:00,NSW
Back Ck at Bentley,10.53am Fri,0.79,steady,,Plot | Table,2022-10-14 14:10:02.390794+11:00,NSW
Leycester Ck at Rock Valley,11.15am Fri,1.16,steady,,Plot | Table,2022-10-14 14:10:02.390794+11:00,NSW
Goolmangar Ck at Nimbin,1.44pm Fri,1.90,steady,,Plot | Table,2022-10-14 14:10:02.390794+11:00,NSW
Goolmangar Ck at Goolmangar,1.44pm Fri,0.99,steady,,Plot | Table,2022-10-14 14:10:02.390794+11:00,NSW
Terania Ck at The Channon,1.44pm Fri,0.18,steady,,Plot | Table,2022-10-14 14:10:02.390794+11:00,NSW
Leycester Ck at Tuncester (mAHD),1.42pm Fri,0.12^,steady,,Plot | Table,2022-10-14 14:10:02.390794+11:00,NSW
Coopers Ck at Repentance,11.42am Fri,0.53,steady,,Plot | Table,2022-10-14 14:10:02.390794+11:00,NSW
Coopers Ck at Corndale,12.15pm Fri,0.63,steady,,Plot | Table,2022-10-14 14:10:02.390794+11:00,NSW
Wilsons R at Nashua,12.51pm Fri,0.58,steady,,Plot | Table,2022-10-14 14:10:02.390794+11:00,NSW
Wilsons R at Eltham,12.47pm Fri,1.28,steady,,Plot | Table,2022-10-14 14:10:02.390794+11:00,NSW
Wilsons R at Woodlawn (mAHD),1.39pm Fri,0.10^,steady,,Plot | Table,2022-10-14 14:10:02.390794+11:00,NSW
Browns Ck Pump Station,1.25pm Fri,5.02,steady,,Plot | Table,2022-10-14 14:10:02.390794+11:00,NSW
Lismore (Dawson Street),12.07pm Fri,1.90,steady,,Plot | Table,2022-10-14 14:10:02.390794+11:00,NSW
Wilsons R at Lismore (mAHD),1.43pm Fri,0.15^,steady,below minor,Plot | Table,2022-10-14 14:10:02.390794+11:00,NSW
Wilsons R at East Gundurimba,1.15pm Fri,1.03,rising,,Plot | Table,2022-10-14 14:10:02.390794+11:00,NSW
Wilsons R at Tuckurimba,1.43pm Fri,0.98,steady,,Plot | Table,2022-10-14 14:10:02.390794+11:00,NSW
Richmond River to Coraki,Richmond River to Coraki,Richmond River to Coraki,Richmond River to Coraki,Richmond River to Coraki,Richmond River to Coraki,2022-10-14 14:10:02.390794+11:00,NSW
Richmond R at Wiangaree,1.00pm Fri,0.22,steady,below minor,Plot | Table,2022-10-14 14:10:02.390794+11:00,NSW
Richmond R at Kyogle,1.00pm Fri,0.53,steady,below minor,Plot | Table,2022-10-14 14:10:02.390794+11:00,NSW
Eden Ck at Doubtful,1.00pm Fri,1.06,steady,,Plot | Table,2022-10-14 14:10:02.390794+11:00,NSW
Richmond R at Casino**,1.00pm Fri,1.02,steady,below minor,Plot | Table,2022-10-14 14:10:02.390794+11:00,NSW
Shannon Brook at Yorklea,1.00pm Fri,1.36,falling,,Plot | Table,2022-10-14 14:10:02.390794+11:00,NSW
Richmond R at Coraki,1.15pm Fri,1.12,rising,below minor,Plot | Table,2022-10-14 14:10:02.390794+11:00,NSW
Lower Richmond River,Lower Richmond River,Lower Richmond River,Lower Richmond River,Lower Richmond River,Lower Richmond River,2022-10-14 14:10:02.390794+11:00,NSW
Myrtle Ck at Rappville,12.00pm Fri,0.33,steady,,Plot | Table,2022-10-14 14:10:02.390794+11:00,NSW
Bungawalbin Ck at Neileys Lagoon Rd,1.15pm Fri,1.50,steady,,Plot | Table,2022-10-14 14:10:02.390794+11:00,NSW
Richmond R at Bungawalbin,1.15pm Fri,1.14,rising,below minor,Plot | Table,2022-10-14 14:10:02.390794+11:00,NSW
Richmond R at Byrnes Pt,1.15pm Fri,1.48,falling,,Plot | Table,2022-10-14 14:10:02.390794+11:00,NSW
Rocky Mouth Ck U/S Evans R,1.15pm Fri,0.93,rising,,Plot | Table,2022-10-14 14:10:02.390794+11:00,NSW
Evans R at Tucombil Hwy Br,1.15pm Fri,1.35,rising,,Plot | Table,2022-10-14 14:10:02.390794+11:00,NSW
Evans R at Evans Head,1.15pm Fri,1.42,falling,,Plot | Table,2022-10-14 14:10:02.390794+11:00,NSW
Lake Ainsworth,1.15pm Fri,2.83,steady,,Plot | Table,2022-10-14 14:10:02.390794+11:00,NSW
Maguires Ck at Teven,12.43pm Fri,0.44,steady,,Plot | Table,2022-10-14 14:10:02.390794+11:00,NSW
Clarence River to Baryulgil,Clarence River to Baryulgil,Clarence River to Baryulgil,Clarence River to Baryulgil,Clarence River to Baryulgil,Clarence River to Baryulgil,2022-10-14 14:10:02.390794+11:00,NSW
Maryland R at Wylie Creek,1.15pm Fri,0.66,steady,,Plot | Table,2022-10-14 14:10:02.390794+11:00,NSW
Cataract R at Sandy Hill,12.00pm Fri,0.73,steady,,Plot | Table,2022-10-14 14:10:02.390794+11:00,NSW
Peacock Ck at Bonalbo,1.00pm Fri,0.17,steady,,Plot | Table,2022-10-14 14:10:02.390794+11:00,NSW
Clarence R at Tabulam,1.00pm Fri,0.83,steady,,Plot | Table,2022-10-14 14:10:02.390794+11:00,NSW
Timbarra R at Billyrimba,1.15pm Fri,0.69,steady,,Plot | Table,2022-10-14 14:10:02.390794+11:00,NSW
Timbarra R at Drake,12.00pm Fri,1.42,steady,,Plot | Table,2022-10-14 14:10:02.390794+11:00,NSW
Clarence R at Baryulgil,1.15pm Fri,2.12,steady,,Plot | Table,2022-10-14 14:10:02.390794+11:00,NSW
Mann and Nymboida Rivers,Mann and Nymboida Rivers,Mann and Nymboida Rivers,Mann and Nymboida Rivers,Mann and Nymboida Rivers,Mann and Nymboida Rivers,2022-10-14 14:10:02.390794+11:00,NSW
Mann R at Shannon Vale,1.00pm Fri,0.72,steady,,Plot | Table,2022-10-14 14:10:02.390794+11:00,NSW
Mann R at Mitchell,1.00pm Fri,0.97,steady,,Plot | Table,2022-10-14 14:10:02.390794+11:00,NSW
Aberfoyle R at Aberfoyle,1.00pm Fri,0.73,steady,,Plot | Table,2022-10-14 14:10:02.390794+11:00,NSW
Guy Fawkes R at Ebor,1.00pm Fri,0.58,steady,,Plot | Table,2022-10-14 14:10:02.390794+11:00,NSW
Boyd R at Broadmeadows,1.00pm Fri,1.35,steady,,Plot | Table,2022-10-14 14:10:02.390794+11:00,NSW
Bielsdown Ck at Dorrigo,1.00pm Fri,0.73,steady,,Plot | Table,2022-10-14 14:10:02.390794+11:00,NSW
Nymboida R at Nymboida,1.00pm Fri,1.34,steady,,Plot | Table,2022-10-14 14:10:02.390794+11:00,NSW
Nymboida R d/s Nymboida Weir,11.00am Fri,1.94,steady,,Plot | Table,2022-10-14 14:10:02.390794+11:00,NSW
Mann R at Jackadgery,1.00pm Fri,1.67,steady,,Plot | Table,2022-10-14 14:10:02.390794+11:00,NSW
Dandahra Ck at Gibraltar Range,1.00pm Fri,0.47,steady,,Plot | Table,2022-10-14 14:10:02.390794+11:00,NSW
Lower Clarence River,Lower Clarence River,Lower Clarence River,Lower Clarence River,Lower Clarence River,Lower Clarence River,2022-10-14 14:10:02.390794+11:00,NSW
Clarence R at Lilydale,1.00pm Fri,1.93,steady,,Plot | Table,2022-10-14 14:10:02.390794+11:00,NSW
Orara R at Orange Grove,1.05pm Fri,1.98,steady,,Plot | Table,2022-10-14 14:10:02.390794+11:00,NSW
Orara R at Karangi,1.00pm Fri,1.06,steady,,Plot | Table,2022-10-14 14:10:02.390794+11:00,NSW
Orara R at Glenreagh TM**,1.00pm Fri,0.79,steady,below minor,Plot | Table,2022-10-14 14:10:02.390794+11:00,NSW
Orara R at Bawden Bridge**,1.00pm Fri,1.19,steady,,Plot | Table,2022-10-14 14:10:02.390794+11:00,NSW
Clarence R at Rogans Br.,1.15pm Fri,0.34,rising,,Plot | Table,2022-10-14 14:10:02.390794+11:00,NSW
Clarence R at Grafton (Prince St),1.15pm Fri,0.47,steady,below minor,Plot | Table,2022-10-14 14:10:02.390794+11:00,NSW
Clarence R at Ulmarra,1.15pm Fri,0.34,steady,below minor,Plot | Table,2022-10-14 14:10:02.390794+11:00,NSW
Coldstream R at Tyndale,1.15pm Fri,0.36,steady,,Plot | Table,2022-10-14 14:10:02.390794+11:00,NSW
Clarence R at Lawrence^,1.18pm Fri,0.37,steady,,Plot | Table,2022-10-14 14:10:02.390794+11:00,NSW
Clarence R at Maclean,1.15pm Fri,0.45,steady,below minor,Plot | Table,2022-10-14 14:10:02.390794+11:00,NSW
Clarence R at Yamba,1.16pm Fri,1.42,falling,,Plot | Table,2022-10-14 14:10:02.390794+11:00,NSW
Wooli River,Wooli River,Wooli River,Wooli River,Wooli River,Wooli River,2022-10-14 14:10:02.390794+11:00,NSW
Wooli R at Caravan Park,1.15pm Fri,0.58,falling,below minor,Plot | Table,2022-10-14 14:10:02.390794+11:00,NSW
Wooli R at Entrance,1.15pm Fri,0.57,steady,,Plot | Table,2022-10-14 14:10:02.390794+11:00,NSW
