Station Name,Time/Day,Height,Tendency,Flood Class,Recent Data,Scraped,State
Werribee Catchment,Werribee Catchment,Werribee Catchment,Werribee Catchment,Werribee Catchment,Werribee Catchment,2022-10-14 17:10:02.611578+11:00,VIC
Werribee R at Ballan,3.53pm Fri,1.93,steady,minor,Plot | Table,2022-10-14 17:10:02.611578+11:00,VIC
Werribee R at Bacchus Marsh,4.11pm Fri,1.26,falling,below minor,Plot | Table,2022-10-14 17:10:02.611578+11:00,VIC
Parwan Ck at Parwan,11.45am Fri,0.70,falling,,Plot | Table,2022-10-14 17:10:02.611578+11:00,VIC
Lerderderg R at Sardine Ck,4.00pm Fri,1.57,steady,below minor,Plot | Table,2022-10-14 17:10:02.611578+11:00,VIC
Lerderderg R at U/S Goodman Ck,4.07pm Fri,1.22,steady,below minor,Plot | Table,2022-10-14 17:10:02.611578+11:00,VIC
Werribee R at Melton Res D/S,3.48pm Fri,2.68^,rising,minor,Plot | Table,2022-10-14 17:10:02.611578+11:00,VIC
Toolern Ck at Melton South,4.06pm Fri,0.79,steady,,Plot | Table,2022-10-14 17:10:02.611578+11:00,VIC
Werribee R at Werribee Cottrell St,4.00pm Fri,4.97,falling,moderate,Plot | Table,2022-10-14 17:10:02.611578+11:00,VIC
Maribyrnong Catchment,Maribyrnong Catchment,Maribyrnong Catchment,Maribyrnong Catchment,Maribyrnong Catchment,Maribyrnong Catchment,2022-10-14 17:10:02.611578+11:00,VIC
Deep Ck at Lancefield,3.04pm Fri,2.79,falling,,Plot | Table,2022-10-14 17:10:02.611578+11:00,VIC
Maribyrnong R at Keilor,4.00pm Fri,6.38,falling,major,Plot | Table,2022-10-14 17:10:02.611578+11:00,VIC
Maribyrnong R at Maribyrnong,2.49pm Fri,3.86,,major,Plot | Table,2022-10-14 17:10:02.611578+11:00,VIC
Stony Ck at Spotswood,4.05pm Fri,0.97,rising,,Plot | Table,2022-10-14 17:10:02.611578+11:00,VIC
Yarra Catchment,Yarra Catchment,Yarra Catchment,Yarra Catchment,Yarra Catchment,Yarra Catchment,2022-10-14 17:10:02.611578+11:00,VIC
Yarra R at Millgrove,4.15pm Fri,1.82,steady,below minor,Plot | Table,2022-10-14 17:10:02.611578+11:00,VIC
Little Yarra R at Yarra Junction,4.04pm Fri,1.44,steady,,Plot | Table,2022-10-14 17:10:02.611578+11:00,VIC
Woori Yallock Ck at Woori Yallock,1.08pm Fri,2.56,,,Plot | Table,2022-10-14 17:10:02.611578+11:00,VIC
Yarra R at Yarra Glen,4.11pm Fri,4.52,steady,minor,Plot | Table,2022-10-14 17:10:02.611578+11:00,VIC
Olinda Ck at Mt Evelyn,4.10pm Fri,1.36,falling,,Plot | Table,2022-10-14 17:10:02.611578+11:00,VIC
Olinda Ck at Lilydale,4.10pm Fri,6.22,steady,,Plot | Table,2022-10-14 17:10:02.611578+11:00,VIC
Brushy Ck at Mooroolbark,5.55am Fri,1.87,,,Plot | Table,2022-10-14 17:10:02.611578+11:00,VIC
Yarra R at Warrandyte,2.05pm Fri,2.25,rising,below minor,Plot | Table,2022-10-14 17:10:02.611578+11:00,VIC
Mullum Mullum Ck at Doncaster East,3.50pm Fri,0.86,rising,,Plot | Table,2022-10-14 17:10:02.611578+11:00,VIC
Arthurs Ck at Nutfield,2.06am Fri,4.93,,,Plot | Table,2022-10-14 17:10:02.611578+11:00,VIC
Diamond Ck at Eltham,4.10pm Fri,3.72,falling,below minor,Plot | Table,2022-10-14 17:10:02.611578+11:00,VIC
Yarra R at Fitzimons Lane,4.12pm Fri,4.41,falling,minor,Plot | Table,2022-10-14 17:10:02.611578+11:00,VIC
Plenty R at Greensborough,3.48pm Fri,3.36,falling,,Plot | Table,2022-10-14 17:10:02.611578+11:00,VIC
Plenty River at Lower Plenty,4.08pm Fri,4.14,falling,below minor,Plot | Table,2022-10-14 17:10:02.611578+11:00,VIC
Koonung Ck at Bulleen,3.57pm Fri,3.44,steady,,Plot | Table,2022-10-14 17:10:02.611578+11:00,VIC
Darebin Ck at Bundoora,3.40pm Fri,5.89,,,Plot | Table,2022-10-14 17:10:02.611578+11:00,VIC
Darebin Ck at Bell St Ivanhoe,3.58pm Fri,1.23,steady,,Plot | Table,2022-10-14 17:10:02.611578+11:00,VIC
Merri Ck at Craigeburn,1.05am Fri,2.20,,,Plot | Table,2022-10-14 17:10:02.611578+11:00,VIC
Merri Ck at Cooper St,3.49pm Fri,2.69,steady,,Plot | Table,2022-10-14 17:10:02.611578+11:00,VIC
Merlynston Ck at Fawkner Cemetry,2.55pm Fri,1.87,steady,,Plot | Table,2022-10-14 17:10:02.611578+11:00,VIC
Moonee Ponds Ck at Jacana,4.09pm Fri,1.46,falling,,Plot | Table,2022-10-14 17:10:02.611578+11:00,VIC
Merri Ck at Bell St,3.59pm Fri,2.46,falling,below minor,Plot | Table,2022-10-14 17:10:02.611578+11:00,VIC
Merri Ck at St Georges Rd,4.08pm Fri,2.96,steady,below minor,Plot | Table,2022-10-14 17:10:02.611578+11:00,VIC
Yarra R at Johnston St,4.04pm Fri,4.95,rising,minor,Plot | Table,2022-10-14 17:10:02.611578+11:00,VIC
Yarra R at Hawthorn,9.55am Fri,2.44,,,Plot | Table,2022-10-14 17:10:02.611578+11:00,VIC
Gardiners Ck at Kinkora Rd,4.12pm Fri,0.73,falling,,Plot | Table,2022-10-14 17:10:02.611578+11:00,VIC
Eley Rd East Drain at Eley Rd,3.55pm Fri,0.69,,,Plot | Table,2022-10-14 17:10:02.611578+11:00,VIC
Gardiners Ck at Blackburn Lake,4.12pm Fri,1.28,steady,,Plot | Table,2022-10-14 17:10:02.611578+11:00,VIC
Scotchmans Ck at Huntingdale Rd,4.10pm Fri,2.45,steady,,Plot | Table,2022-10-14 17:10:02.611578+11:00,VIC
Scotchmans Ck at Waverley Rd,4.10pm Fri,2.16,falling,,Plot | Table,2022-10-14 17:10:02.611578+11:00,VIC
Gardiners Ck at Ashwood,4.14pm Fri,0.96,steady,,Plot | Table,2022-10-14 17:10:02.611578+11:00,VIC
Gardiners Ck at Gardiners,4.14pm Fri,0.49,rising,,Plot | Table,2022-10-14 17:10:02.611578+11:00,VIC
Edgars Ck at Edwardes Lake,4.11pm Fri,0.30,steady,,Plot | Table,2022-10-14 17:10:02.611578+11:00,VIC
Elsternwick Main Drain,2.05pm Fri,0.39,,,Plot | Table,2022-10-14 17:10:02.611578+11:00,VIC
St Kilda Marina,2.48pm Fri,0.32,rising,,Plot | Table,2022-10-14 17:10:02.611578+11:00,VIC
Dandenong,Dandenong,Dandenong,Dandenong,Dandenong,Dandenong,2022-10-14 17:10:02.611578+11:00,VIC
Bangalook Ck at Montrose,4.07pm Fri,5.66,steady,,Plot | Table,2022-10-14 17:10:02.611578+11:00,VIC
Dandenong Ck at the Basin,4.08pm Fri,7.57,falling,,Plot | Table,2022-10-14 17:10:02.611578+11:00,VIC
Dandenong Ck at Heathmont,4.12pm Fri,2.88,falling,,Plot | Table,2022-10-14 17:10:02.611578+11:00,VIC
Blind Ck at Knox,4.13pm Fri,0.68,steady,,Plot | Table,2022-10-14 17:10:02.611578+11:00,VIC
Blind Ck at Wantirna south,4.09pm Fri,2.96,falling,,Plot | Table,2022-10-14 17:10:02.611578+11:00,VIC
Dandenong Ck at Rowville,3.58pm Fri,4.40,steady,below minor,Plot | Table,2022-10-14 17:10:02.611578+11:00,VIC
Mile Ck at Springvale West,4.13pm Fri,0.11,steady,,Plot | Table,2022-10-14 17:10:02.611578+11:00,VIC
Dandenong Ck at Hammond Rd,4.10pm Fri,3.53,steady,,Plot | Table,2022-10-14 17:10:02.611578+11:00,VIC
Dandenong Ck at Greens Rd,4.12pm Fri,3.33,steady,,Plot | Table,2022-10-14 17:10:02.611578+11:00,VIC
Mile Ck at Keysborough,3.59pm Fri,0.59,steady,,Plot | Table,2022-10-14 17:10:02.611578+11:00,VIC
Eumemmering Ck at Narre Warren Nth,3.57pm Fri,0.71,steady,,Plot | Table,2022-10-14 17:10:02.611578+11:00,VIC
Hallam Valley at Hampton Park,4.13pm Fri,2.49,steady,,Plot | Table,2022-10-14 17:10:02.611578+11:00,VIC
Eumemmering Ck at Lyndhurst,4.13pm Fri,2.14,steady,,Plot | Table,2022-10-14 17:10:02.611578+11:00,VIC
Dunlops Rd Drain at Braeside,4.11pm Fri,1.29,steady,,Plot | Table,2022-10-14 17:10:02.611578+11:00,VIC
Patterson R at Whalers Cove,4.14pm Fri,0.71,steady,,Plot | Table,2022-10-14 17:10:02.611578+11:00,VIC
Kananook Ck at Seaford,4.14pm Fri,5.11,steady,,Plot | Table,2022-10-14 17:10:02.611578+11:00,VIC
Bunyip,Bunyip,Bunyip,Bunyip,Bunyip,Bunyip,2022-10-14 17:10:02.611578+11:00,VIC
Bunyip R d/s Headworks,4.04pm Fri,1.91,steady,,Plot | Table,2022-10-14 17:10:02.611578+11:00,VIC
Tonimbuk,4.01pm Fri,4.92,steady,,Plot | Table,2022-10-14 17:10:02.611578+11:00,VIC
Tarago R at Neerim South,3.35pm Fri,3.64,steady,,Plot | Table,2022-10-14 17:10:02.611578+11:00,VIC
Bunyip R at Longwarry North,3.58pm Fri,3.33,steady,,Plot | Table,2022-10-14 17:10:02.611578+11:00,VIC
Iona,4.10pm Fri,2.52,rising,minor,Plot | Table,2022-10-14 17:10:02.611578+11:00,VIC
Bunyip R at Cora Lynn Ford,4.07pm Fri,3.75,steady,minor,Plot | Table,2022-10-14 17:10:02.611578+11:00,VIC
Bunyip R Kooweerup,4.04pm Fri,3.20,rising,,Plot | Table,2022-10-14 17:10:02.611578+11:00,VIC
Lang Lang R at Yannathan,4.13pm Fri,1.95,steady,,Plot | Table,2022-10-14 17:10:02.611578+11:00,VIC
Deep Ck at Pakenham,4.15pm Fri,3.63,steady,,Plot | Table,2022-10-14 17:10:02.611578+11:00,VIC
Kennedy Ck at Pakenham,3.43pm Fri,0.67,steady,,Plot | Table,2022-10-14 17:10:02.611578+11:00,VIC
Toomuc Ck at Pakenham,4.11pm Fri,0.39,steady,,Plot | Table,2022-10-14 17:10:02.611578+11:00,VIC
Gumscrub Ck at Officer,4.14pm Fri,1.27,steady,,Plot | Table,2022-10-14 17:10:02.611578+11:00,VIC
Cardinia Ck at Cardinia,3.53pm Fri,3.23,rising,,Plot | Table,2022-10-14 17:10:02.611578+11:00,VIC
