Station Name,Time/Day,Height,Tendency,Flood Class,Recent Data,Scraped,State
Upper Murray Catchment,Upper Murray Catchment,Upper Murray Catchment,Upper Murray Catchment,Upper Murray Catchment,Upper Murray Catchment,2022-10-14 14:00:02.115139+11:00,VIC
Murray R at Biggara,1.00pm Fri,1.56,steady,below minor,Plot | Table,2022-10-14 14:00:02.115139+11:00,VIC
Murray R at Bringenbrong,1.00pm Fri,2.39,steady,below minor,Plot | Table,2022-10-14 14:00:02.115139+11:00,VIC
Corryong Ck at Towong,1.00pm Fri,1.93,rising,,Plot | Table,2022-10-14 14:00:02.115139+11:00,VIC
Mannus Ck at Yarramundi,1.00pm Fri,2.07,falling,,Plot | Table,2022-10-14 14:00:02.115139+11:00,VIC
Manus Ck at Tooma,1.00pm Fri,1.08,steady,,Plot | Table,2022-10-14 14:00:02.115139+11:00,VIC
Tumbarumba Ck at Tumba2,1.00pm Fri,1.53,steady,,Plot | Table,2022-10-14 14:00:02.115139+11:00,VIC
Maragle Ck at Maragle,1.00pm Fri,1.02,steady,,Plot | Table,2022-10-14 14:00:02.115139+11:00,VIC
Tumbarumba Ck at Bakers,1.00pm Fri,3.52,steady,,Plot | Table,2022-10-14 14:00:02.115139+11:00,VIC
Welumba Ck at The Square,1.00pm Fri,0.75,steady,,Plot | Table,2022-10-14 14:00:02.115139+11:00,VIC
Tooma R at Pinegrove,1.00pm Fri,2.93,rising,,Plot | Table,2022-10-14 14:00:02.115139+11:00,VIC
Cudgewa Ck at Berringama,1.00pm Fri,2.06,steady,,Plot | Table,2022-10-14 14:00:02.115139+11:00,VIC
Cudgewa Ck at Cudgewa North,1.00pm Fri,1.76,steady,,Plot | Table,2022-10-14 14:00:02.115139+11:00,VIC
Murray R at Jingellic,1.00pm Fri,2.94,steady,below minor,Plot | Table,2022-10-14 14:00:02.115139+11:00,VIC
Jingellic Ck at Jingellic,1.00pm Fri,2.44,falling,,Plot | Table,2022-10-14 14:00:02.115139+11:00,VIC
Murray R at Heywoods,1.00pm Fri,3.96,steady,,Plot | Table,2022-10-14 14:00:02.115139+11:00,VIC
Murray R at Albury,1.00pm Fri,4.20,steady,below minor,Plot | Table,2022-10-14 14:00:02.115139+11:00,VIC
Murray R at Howlong,1.00pm Fri,5.68,steady,,Plot | Table,2022-10-14 14:00:02.115139+11:00,VIC
Murray R at Corowa,1.00pm Fri,5.97,steady,moderate,Plot | Table,2022-10-14 14:00:02.115139+11:00,VIC
Murray R at Yarrawonga,1.00pm Fri,5.79,steady,below minor,Plot | Table,2022-10-14 14:00:02.115139+11:00,VIC
Mitta Mitta Catchment,Mitta Mitta Catchment,Mitta Mitta Catchment,Mitta Mitta Catchment,Mitta Mitta Catchment,Mitta Mitta Catchment,2022-10-14 14:00:02.115139+11:00,VIC
Big R at Joker Creek,1.00pm Fri,2.27,falling,,Plot | Table,2022-10-14 14:00:02.115139+11:00,VIC
Mitta Mitta R at Hinnomunjie,1.00pm Fri,2.29,falling,below minor,Plot | Table,2022-10-14 14:00:02.115139+11:00,VIC
Gibbo R at Gibbo Park,11.00am Fri,1.24^,steady,,Plot | Table,2022-10-14 14:00:02.115139+11:00,VIC
Lake Dartmouth HG,12.00pm Fri,486.64^,rising,,Plot | Table,2022-10-14 14:00:02.115139+11:00,VIC
Mitta Mitta R at Colemans,1.00pm Fri,2.42,steady,below minor,Plot | Table,2022-10-14 14:00:02.115139+11:00,VIC
Snowy Ck at Granite Flat,1.00pm Fri,1.68,steady,,Plot | Table,2022-10-14 14:00:02.115139+11:00,VIC
Mitta Mitta R at Tallandoon,1.00pm Fri,3.68,steady,below minor,Plot | Table,2022-10-14 14:00:02.115139+11:00,VIC
Tallangatta Ck at McCallums,1.00pm Fri,1.35,steady,below minor,Plot | Table,2022-10-14 14:00:02.115139+11:00,VIC
Kiewa Catchment,Kiewa Catchment,Kiewa Catchment,Kiewa Catchment,Kiewa Catchment,Kiewa Catchment,2022-10-14 14:00:02.115139+11:00,VIC
Kiewa R at Mongans Bridge,1.00pm Fri,2.86,steady,minor,Plot | Table,2022-10-14 14:00:02.115139+11:00,VIC
Kiewa R at Kiewa (Mainbranch),1.00pm Fri,3.38,steady,minor,Plot | Table,2022-10-14 14:00:02.115139+11:00,VIC
Kiewa R at Kiewa (Anabranch),12.00pm Fri,1.42^,steady,,Plot | Table,2022-10-14 14:00:02.115139+11:00,VIC
Yackandandah Ck at Osbornes Flat,1.00pm Fri,2.01,falling,,Plot | Table,2022-10-14 14:00:02.115139+11:00,VIC
Kiewa R at Bandiana,1.00pm Fri,3.15,steady,moderate,Plot | Table,2022-10-14 14:00:02.115139+11:00,VIC
Ovens Catchment,Ovens Catchment,Ovens Catchment,Ovens Catchment,Ovens Catchment,Ovens Catchment,2022-10-14 14:00:02.115139+11:00,VIC
Ovens R at Harrietville,1.00pm Fri,2.36,steady,,Plot | Table,2022-10-14 14:00:02.115139+11:00,VIC
Ovens R at Bright,1.10pm Fri,2.85,steady,below minor,Plot | Table,2022-10-14 14:00:02.115139+11:00,VIC
Buckland R at Upper Buckland,12.00pm Fri,2.47,falling,,Plot | Table,2022-10-14 14:00:02.115139+11:00,VIC
Buckland R at Harris Lane,1.08pm Fri,3.03,steady,minor,Plot | Table,2022-10-14 14:00:02.115139+11:00,VIC
Ovens R at Eurobin,1.01pm Fri,4.76,rising,minor,Plot | Table,2022-10-14 14:00:02.115139+11:00,VIC
Happy Valley Ck at Rosewhite,1.03pm Fri,1.06,steady,,Plot | Table,2022-10-14 14:00:02.115139+11:00,VIC
Ovens R at Myrtleford,12.00pm Fri,3.34^,rising,,Plot | Table,2022-10-14 14:00:02.115139+11:00,VIC
Buffalo R at Abbeyard,12.00pm Fri,2.36^,steady,,Plot | Table,2022-10-14 14:00:02.115139+11:00,VIC
Rose R at Matong North,1.13pm Fri,2.04,steady,,Plot | Table,2022-10-14 14:00:02.115139+11:00,VIC
Dandongadale R at Matong North,1.14pm Fri,2.81,steady,,Plot | Table,2022-10-14 14:00:02.115139+11:00,VIC
Buffalo R D/S Rose R Junction,1.14pm Fri,4.26,rising,,Plot | Table,2022-10-14 14:00:02.115139+11:00,VIC
Lake Buffalo HG,1.14pm Fri,242.60^,steady,,Plot | Table,2022-10-14 14:00:02.115139+11:00,VIC
Buffalo R at Lake Buffalo D/S,1.14pm Fri,4.90,steady,minor,Plot | Table,2022-10-14 14:00:02.115139+11:00,VIC
Ovens R at Rocky Point,1.13pm Fri,3.79,steady,minor,Plot | Table,2022-10-14 14:00:02.115139+11:00,VIC
Ovens R at Wangaratta,12.00pm Fri,11.75^,rising,below minor,Plot | Table,2022-10-14 14:00:02.115139+11:00,VIC
Ovens R at Peechelba East,12.00pm Fri,130.04^,steady,,Plot | Table,2022-10-14 14:00:02.115139+11:00,VIC
King Catchment,King Catchment,King Catchment,King Catchment,King Catchment,King Catchment,2022-10-14 14:00:02.115139+11:00,VIC
King R at L. William Hovell D/S,10.00am Fri,2.37,steady,minor,Plot | Table,2022-10-14 14:00:02.115139+11:00,VIC
King R at Cheshunt,1.13pm Fri,2.58,steady,moderate,Plot | Table,2022-10-14 14:00:02.115139+11:00,VIC
King R at Edi,12.00pm Fri,3.09^,rising,,Plot | Table,2022-10-14 14:00:02.115139+11:00,VIC
Boggy Ck at Angleside,1.00pm Fri,1.52,rising,,Plot | Table,2022-10-14 14:00:02.115139+11:00,VIC
King R at Docker Road,1.08pm Fri,4.27,steady,major,Plot | Table,2022-10-14 14:00:02.115139+11:00,VIC
Hurdle Ck at Bobinwarrah,1.10pm Fri,2.73,steady,,Plot | Table,2022-10-14 14:00:02.115139+11:00,VIC
Fifteen Mile Creek Catchment,Fifteen Mile Creek Catchment,Fifteen Mile Creek Catchment,Fifteen Mile Creek Catchment,Fifteen Mile Creek Catchment,Fifteen Mile Creek Catchment,2022-10-14 14:00:02.115139+11:00,VIC
Fifteen Mile Ck at Greta South,1.10pm Fri,3.75,rising,minor,Plot | Table,2022-10-14 14:00:02.115139+11:00,VIC
Fifteen Mile Ck at Glenrowan,1.00pm Fri,2.50,rising,,Plot | Table,2022-10-14 14:00:02.115139+11:00,VIC
