Station Name,Time/Day,Height,Tendency,Crossing,Flood Class,Recent Data,Scraped,State
Lagoon Ck at Moodlu (Williams Rd) #,12.58pm Thu,-0.05,steady,,,Plot | Table,2022-10-13 14:24:34.630307+11:00,QLD
Lagoon Ck at Machinery Pde #,12.10pm Thu,0.20,steady,,,Plot | Table,2022-10-13 14:24:34.630307+11:00,QLD
King John Ck at Beerburrum Rd *,12.50pm Thu,-2.70^,steady,,,Plot | Table,2022-10-13 14:24:34.630307+11:00,QLD
King John Ck at Pumicestone Rd #,10.12am Thu,0.00,steady,,,Plot | Table,2022-10-13 14:24:34.630307+11:00,QLD
King Johns Ck at Bribie Is Rd #,12.15pm Thu,0.33,steady,,,Plot | Table,2022-10-13 14:24:34.630307+11:00,QLD
Caboolture R at Riversleigh Rd #,1.03pm Thu,1.81,falling,,,Plot | Table,2022-10-13 14:24:34.630307+11:00,QLD
Caboolture R at St Smith Rd AL#,12.52pm Thu,0.79,falling,,,Plot | Table,2022-10-13 14:24:34.630307+11:00,QLD
Beachmere #,12.33pm Thu,0.55,steady,,,Plot | Table,2022-10-13 14:24:34.630307+11:00,QLD
Elimbah Ck at Donnybrook Rd #,1.02pm Thu,1.36,rising,,,Plot | Table,2022-10-13 14:24:34.630307+11:00,QLD
