Station Name,Time/Day,Height,Tendency,Flood Class,Recent Data,Scraped,State
Tweed River,Tweed River,Tweed River,Tweed River,Tweed River,Tweed River,2022-10-13 12:51:35.872160+11:00,NSW
Tyalgum Bridge,12.25pm Thu,0.83,steady,,Plot | Table,2022-10-13 12:51:35.872160+11:00,NSW
Clarrie Hall Dam (mAHD),12.10pm Thu,61.54^,steady,,Plot | Table,2022-10-13 12:51:35.872160+11:00,NSW
Clarrie Hall Dam D/S,12.12pm Thu,0.55,steady,,Plot | Table,2022-10-13 12:51:35.872160+11:00,NSW
Tweed R at Palmers Road,12.41pm Thu,0.73,steady,,Plot | Table,2022-10-13 12:51:35.872160+11:00,NSW
Tweed R at Uki,12.00pm Thu,1.23,steady,,Plot | Table,2022-10-13 12:51:35.872160+11:00,NSW
Oxley R at Eungella,11.41am Thu,0.57,steady,,Plot | Table,2022-10-13 12:51:35.872160+11:00,NSW
Tweed R at Bray Park Weir (mAHD),10.45am Thu,1.14^,steady,,Plot | Table,2022-10-13 12:51:35.872160+11:00,NSW
Tweed R at Murwillumbah Br (mAHD),12.39pm Thu,0.78^,steady,,Plot | Table,2022-10-13 12:51:35.872160+11:00,NSW
Tweed R at Murwillumbah (mAHD),12.43pm Thu,0.78^,steady,below minor,Plot | Table,2022-10-13 12:51:35.872160+11:00,NSW
Rous R at Chillingham,11.53am Thu,0.99,steady,,Plot | Table,2022-10-13 12:51:35.872160+11:00,NSW
Rous R at Boat Harbour,12.40pm Thu,0.62,steady,,Plot | Table,2022-10-13 12:51:35.872160+11:00,NSW
Rous R at Boat Harbour (Nobbys Ck),12.00pm Thu,0.86,steady,,Plot | Table,2022-10-13 12:51:35.872160+11:00,NSW
Rouse R at Kynnumboon,12.43pm Thu,0.66^,steady,,Plot | Table,2022-10-13 12:51:35.872160+11:00,NSW
Tweed R at Tumbulgum,12.41pm Thu,0.73^,steady,below minor,Plot | Table,2022-10-13 12:51:35.872160+11:00,NSW
Tweed R at Chindera (mAHD),12.42pm Thu,0.57^,steady,below minor,Plot | Table,2022-10-13 12:51:35.872160+11:00,NSW
Tweed R at Barneys Point,12.15pm Thu,1.53,rising,below minor,Plot | Table,2022-10-13 12:51:35.872160+11:00,NSW
Tweed R at Dry Dock (mAHD),12.41pm Thu,0.60^,steady,,Plot | Table,2022-10-13 12:51:35.872160+11:00,NSW
Tweed Coastal Creeks,Tweed Coastal Creeks,Tweed Coastal Creeks,Tweed Coastal Creeks,Tweed Coastal Creeks,Tweed Coastal Creeks,2022-10-13 12:51:35.872160+11:00,NSW
Cudgen Ck at Kingscliff,12.16pm Thu,0.74,falling,,Plot | Table,2022-10-13 12:51:35.872160+11:00,NSW
Cudgen Lake at Bogangar,12.15pm Thu,0.43,steady,,Plot | Table,2022-10-13 12:51:35.872160+11:00,NSW
Burringbar Ck at Tweed Valley Way,12.00pm Thu,0.69,steady,,Plot | Table,2022-10-13 12:51:35.872160+11:00,NSW
Crabbes Ck at Crabbes Creek,10.46am Thu,0.91,steady,,Plot | Table,2022-10-13 12:51:35.872160+11:00,NSW
Crabbes Ck at Wooyung Road,11.33am Thu,1.25,steady,,Plot | Table,2022-10-13 12:51:35.872160+11:00,NSW
Brunswick River,Brunswick River,Brunswick River,Brunswick River,Brunswick River,Brunswick River,2022-10-13 12:51:35.872160+11:00,NSW
Yelgun Ck at Yelgun,11.33am Thu,2.21,steady,,Plot | Table,2022-10-13 12:51:35.872160+11:00,NSW
Yelgun Ck at Helen St Bridge,12.39pm Thu,0.52,steady,,Plot | Table,2022-10-13 12:51:35.872160+11:00,NSW
Marshalls Ck at The Pocket,12.37pm Thu,0.89,steady,,Plot | Table,2022-10-13 12:51:35.872160+11:00,NSW
Lacks Ck at Middle Pocket,10.57am Thu,2.23,steady,,Plot | Table,2022-10-13 12:51:35.872160+11:00,NSW
Marshalls Ck at Billinudgel,11.59am Thu,0.34,steady,below minor,Plot | Table,2022-10-13 12:51:35.872160+11:00,NSW
Marshalls Ck at Ocean Shores,12.16pm Thu,0.76,steady,,Plot | Table,2022-10-13 12:51:35.872160+11:00,NSW
Brunswick R at Sherrys Br,12.28pm Thu,0.69,steady,,Plot | Table,2022-10-13 12:51:35.872160+11:00,NSW
Mullumbimby Ck at Mullumbimby Creek,10.20am Thu,0.31,steady,,Plot | Table,2022-10-13 12:51:35.872160+11:00,NSW
Mullumbimby Ck at Azalea St Bridge,12.43pm Thu,0.80,steady,,Plot | Table,2022-10-13 12:51:35.872160+11:00,NSW
Brunswick R at Mullumbimby,12.44pm Thu,0.75^,falling,below minor,Plot | Table,2022-10-13 12:51:35.872160+11:00,NSW
Brunswick R at Brunswick Heads,12.16pm Thu,0.74,falling,,Plot | Table,2022-10-13 12:51:35.872160+11:00,NSW
Byron Bay (Tallow Ck Br),12.43pm Thu,1.35,steady,,Plot | Table,2022-10-13 12:51:35.872160+11:00,NSW
Byron Bay (Belongil Ck Br),12.43pm Thu,0.86,steady,,Plot | Table,2022-10-13 12:51:35.872160+11:00,NSW
Wilsons River,Wilsons River,Wilsons River,Wilsons River,Wilsons River,Wilsons River,2022-10-13 12:51:35.872160+11:00,NSW
Back Ck at Bentley,10.53am Thu,0.81,steady,,Plot | Table,2022-10-13 12:51:35.872160+11:00,NSW
Leycester Ck at Rock Valley,10.55am Thu,1.17,steady,,Plot | Table,2022-10-13 12:51:35.872160+11:00,NSW
Goolmangar Ck at Nimbin,12.43pm Thu,1.91,falling,,Plot | Table,2022-10-13 12:51:35.872160+11:00,NSW
Goolmangar Ck at Goolmangar,12.40pm Thu,1.01,rising,,Plot | Table,2022-10-13 12:51:35.872160+11:00,NSW
Terania Ck at The Channon,12.43pm Thu,0.20,rising,,Plot | Table,2022-10-13 12:51:35.872160+11:00,NSW
Leycester Ck at Tuncester (mAHD),12.41pm Thu,0.10^,steady,,Plot | Table,2022-10-13 12:51:35.872160+11:00,NSW
Coopers Ck at Repentance,11.42am Thu,0.53,steady,,Plot | Table,2022-10-13 12:51:35.872160+11:00,NSW
Coopers Ck at Corndale,12.15pm Thu,0.64,steady,,Plot | Table,2022-10-13 12:51:35.872160+11:00,NSW
Wilsons R at Nashua,9.51am Thu,0.59,steady,,Plot | Table,2022-10-13 12:51:35.872160+11:00,NSW
Wilsons R at Eltham,10.58am Thu,1.29,steady,,Plot | Table,2022-10-13 12:51:35.872160+11:00,NSW
Wilsons R at Woodlawn (mAHD),12.35pm Thu,0.09^,rising,,Plot | Table,2022-10-13 12:51:35.872160+11:00,NSW
Browns Ck Pump Station,12.40pm Thu,5.01,steady,,Plot | Table,2022-10-13 12:51:35.872160+11:00,NSW
Lismore (Dawson Street),12.07am Thu,1.90,steady,,Plot | Table,2022-10-13 12:51:35.872160+11:00,NSW
Wilsons R at Lismore (mAHD),12.44pm Thu,0.15^,steady,below minor,Plot | Table,2022-10-13 12:51:35.872160+11:00,NSW
Wilsons R at East Gundurimba,12.15pm Thu,0.98,rising,,Plot | Table,2022-10-13 12:51:35.872160+11:00,NSW
Wilsons R at Tuckurimba,12.36pm Thu,1.00,steady,,Plot | Table,2022-10-13 12:51:35.872160+11:00,NSW
Richmond River to Coraki,Richmond River to Coraki,Richmond River to Coraki,Richmond River to Coraki,Richmond River to Coraki,Richmond River to Coraki,2022-10-13 12:51:35.872160+11:00,NSW
Richmond R at Wiangaree,12.00pm Thu,0.24,steady,below minor,Plot | Table,2022-10-13 12:51:35.872160+11:00,NSW
Richmond R at Kyogle,11.00am Thu,0.58,steady,below minor,Plot | Table,2022-10-13 12:51:35.872160+11:00,NSW
Eden Ck at Doubtful,12.00pm Thu,1.09,steady,,Plot | Table,2022-10-13 12:51:35.872160+11:00,NSW
Richmond R at Casino**,12.00pm Thu,1.06,steady,below minor,Plot | Table,2022-10-13 12:51:35.872160+11:00,NSW
Shannon Brook at Yorklea,12.00pm Thu,1.44,steady,,Plot | Table,2022-10-13 12:51:35.872160+11:00,NSW
Richmond R at Coraki,12.15pm Thu,1.14,rising,below minor,Plot | Table,2022-10-13 12:51:35.872160+11:00,NSW
Lower Richmond River,Lower Richmond River,Lower Richmond River,Lower Richmond River,Lower Richmond River,Lower Richmond River,2022-10-13 12:51:35.872160+11:00,NSW
Myrtle Ck at Rappville,12.00pm Thu,0.35,steady,,Plot | Table,2022-10-13 12:51:35.872160+11:00,NSW
Bungawalbin Ck at Neileys Lagoon Rd,12.15pm Thu,1.54,steady,,Plot | Table,2022-10-13 12:51:35.872160+11:00,NSW
Richmond R at Bungawalbin,12.15pm Thu,1.17,rising,below minor,Plot | Table,2022-10-13 12:51:35.872160+11:00,NSW
Richmond R at Byrnes Pt,12.15pm Thu,1.56,steady,,Plot | Table,2022-10-13 12:51:35.872160+11:00,NSW
Rocky Mouth Ck U/S Evans R,12.15pm Thu,1.04,rising,,Plot | Table,2022-10-13 12:51:35.872160+11:00,NSW
Evans R at Tucombil Hwy Br,12.00pm Thu,1.33,rising,,Plot | Table,2022-10-13 12:51:35.872160+11:00,NSW
Evans R at Evans Head,12.15pm Thu,1.48,falling,,Plot | Table,2022-10-13 12:51:35.872160+11:00,NSW
Lake Ainsworth,12.15pm Thu,2.87,steady,,Plot | Table,2022-10-13 12:51:35.872160+11:00,NSW
Maguires Ck at Teven,12.43pm Thu,0.45,steady,,Plot | Table,2022-10-13 12:51:35.872160+11:00,NSW
Clarence River to Baryulgil,Clarence River to Baryulgil,Clarence River to Baryulgil,Clarence River to Baryulgil,Clarence River to Baryulgil,Clarence River to Baryulgil,2022-10-13 12:51:35.872160+11:00,NSW
Maryland R at Wylie Creek,12.00pm Thu,0.69,steady,,Plot | Table,2022-10-13 12:51:35.872160+11:00,NSW
Cataract R at Sandy Hill,8.00am Thu,0.74,steady,,Plot | Table,2022-10-13 12:51:35.872160+11:00,NSW
Peacock Ck at Bonalbo,12.00pm Thu,0.18,steady,,Plot | Table,2022-10-13 12:51:35.872160+11:00,NSW
Clarence R at Tabulam,12.00pm Thu,0.90,steady,,Plot | Table,2022-10-13 12:51:35.872160+11:00,NSW
Timbarra R at Billyrimba,12.00pm Thu,0.72,steady,,Plot | Table,2022-10-13 12:51:35.872160+11:00,NSW
Timbarra R at Drake,9.15am Thu,1.43,steady,,Plot | Table,2022-10-13 12:51:35.872160+11:00,NSW
Clarence R at Baryulgil,12.15pm Thu,2.17,steady,,Plot | Table,2022-10-13 12:51:35.872160+11:00,NSW
Mann and Nymboida Rivers,Mann and Nymboida Rivers,Mann and Nymboida Rivers,Mann and Nymboida Rivers,Mann and Nymboida Rivers,Mann and Nymboida Rivers,2022-10-13 12:51:35.872160+11:00,NSW
Mann R at Shannon Vale,12.00pm Thu,0.77,steady,,Plot | Table,2022-10-13 12:51:35.872160+11:00,NSW
Mann R at Mitchell,12.00pm Thu,1.00,steady,,Plot | Table,2022-10-13 12:51:35.872160+11:00,NSW
Aberfoyle R at Aberfoyle,12.00pm Thu,0.77,steady,,Plot | Table,2022-10-13 12:51:35.872160+11:00,NSW
Guy Fawkes R at Ebor,12.00pm Thu,0.60,steady,,Plot | Table,2022-10-13 12:51:35.872160+11:00,NSW
Boyd R at Broadmeadows,12.00pm Thu,1.44,steady,,Plot | Table,2022-10-13 12:51:35.872160+11:00,NSW
Bielsdown Ck at Dorrigo,12.00pm Thu,0.74,steady,,Plot | Table,2022-10-13 12:51:35.872160+11:00,NSW
Nymboida R at Nymboida,12.00pm Thu,1.38,steady,,Plot | Table,2022-10-13 12:51:35.872160+11:00,NSW
Nymboida R d/s Nymboida Weir,12.15pm Thu,1.96,steady,,Plot | Table,2022-10-13 12:51:35.872160+11:00,NSW
Mann R at Jackadgery,12.00pm Thu,1.75,steady,,Plot | Table,2022-10-13 12:51:35.872160+11:00,NSW
Dandahra Ck at Gibraltar Range,12.15pm Thu,0.48,steady,,Plot | Table,2022-10-13 12:51:35.872160+11:00,NSW
Lower Clarence River,Lower Clarence River,Lower Clarence River,Lower Clarence River,Lower Clarence River,Lower Clarence River,2022-10-13 12:51:35.872160+11:00,NSW
Clarence R at Lilydale,12.00pm Thu,2.07,steady,,Plot | Table,2022-10-13 12:51:35.872160+11:00,NSW
Orara R at Orange Grove,12.05pm Thu,1.99,steady,,Plot | Table,2022-10-13 12:51:35.872160+11:00,NSW
Orara R at Karangi,12.00pm Thu,1.07,steady,,Plot | Table,2022-10-13 12:51:35.872160+11:00,NSW
Orara R at Glenreagh TM**,12.00pm Thu,0.82,steady,below minor,Plot | Table,2022-10-13 12:51:35.872160+11:00,NSW
Orara R at Bawden Bridge**,12.00pm Thu,1.24,steady,,Plot | Table,2022-10-13 12:51:35.872160+11:00,NSW
Clarence R at Rogans Br.,12.15pm Thu,0.27,rising,,Plot | Table,2022-10-13 12:51:35.872160+11:00,NSW
Clarence R at Grafton (Prince St),12.15pm Thu,0.41,steady,below minor,Plot | Table,2022-10-13 12:51:35.872160+11:00,NSW
Clarence R at Ulmarra,12.15pm Thu,0.29,steady,below minor,Plot | Table,2022-10-13 12:51:35.872160+11:00,NSW
Coldstream R at Tyndale,12.15pm Thu,0.34,steady,,Plot | Table,2022-10-13 12:51:35.872160+11:00,NSW
Clarence R at Lawrence^,12.24pm Thu,0.38,steady,,Plot | Table,2022-10-13 12:51:35.872160+11:00,NSW
Clarence R at Maclean,12.15pm Thu,0.45,steady,below minor,Plot | Table,2022-10-13 12:51:35.872160+11:00,NSW
Clarence R at Yamba,12.16pm Thu,1.47,falling,,Plot | Table,2022-10-13 12:51:35.872160+11:00,NSW
Wooli River,Wooli River,Wooli River,Wooli River,Wooli River,Wooli River,2022-10-13 12:51:35.872160+11:00,NSW
Wooli R at Caravan Park,12.15pm Thu,0.60,steady,below minor,Plot | Table,2022-10-13 12:51:35.872160+11:00,NSW
Wooli R at Entrance,12.15pm Thu,0.62,falling,,Plot | Table,2022-10-13 12:51:35.872160+11:00,NSW
