Station Name,Time/Day,Height,Tendency,Flood Class,Recent Data,Scraped,State
Queanbeyan River,Queanbeyan River,Queanbeyan River,Queanbeyan River,Queanbeyan River,Queanbeyan River,2022-10-14 15:50:02.540566+11:00,NSW
Queanbeyan R at Tinderry,3.03pm Fri,1.75,steady,,Plot | Table,2022-10-14 15:50:02.540566+11:00,NSW
Queanbeyan R U/S Googong Dam,1.55pm Fri,1.25,falling,,Plot | Table,2022-10-14 15:50:02.540566+11:00,NSW
Burra Ck at Burra,1.00pm Fri,1.80,steady,,Plot | Table,2022-10-14 15:50:02.540566+11:00,NSW
Queanbeyan R at Googong Dam,1.50pm Fri,663.21^,steady,,Plot | Table,2022-10-14 15:50:02.540566+11:00,NSW
Queanbeyan R at Wickerslack,3.20pm Fri,1.15,steady,,Plot | Table,2022-10-14 15:50:02.540566+11:00,NSW
Queanbeyan R at ACT Border,1.19pm Fri,2.13,falling,,Plot | Table,2022-10-14 15:50:02.540566+11:00,NSW
Molonglo River,Molonglo River,Molonglo River,Molonglo River,Molonglo River,Molonglo River,2022-10-14 15:50:02.540566+11:00,NSW
Molonglo R at Carwoola,2.06pm Fri,1.15,steady,,Plot | Table,2022-10-14 15:50:02.540566+11:00,NSW
Molonglo R at Burbong,1.00pm Fri,0.84,steady,,Plot | Table,2022-10-14 15:50:02.540566+11:00,NSW
Molonglo R at Oaks Estate,1.00pm Fri,1.77,steady,below minor,Plot | Table,2022-10-14 15:50:02.540566+11:00,NSW
Woolshed Creek U/S Fairbairne,3.27pm Fri,0.77,steady,,Plot | Table,2022-10-14 15:50:02.540566+11:00,NSW
Molonglo R at Dairy Flat,12.13pm Fri,556.00^,rising,,Plot | Table,2022-10-14 15:50:02.540566+11:00,NSW
Jerrabomberra Ck at Hindmarsh,3.18pm Fri,2.76,falling,,Plot | Table,2022-10-14 15:50:02.540566+11:00,NSW
Sullivan Ck at Southwell,1.00pm Fri,0.46,steady,,Plot | Table,2022-10-14 15:50:02.540566+11:00,NSW
Sullivan Ck at Barry Drive,5.22am Fri,1.51,rising,,Plot | Table,2022-10-14 15:50:02.540566+11:00,NSW
Lake Burley Griffin at Dam,1.06pm Fri,555.92^,steady,,Plot | Table,2022-10-14 15:50:02.540566+11:00,NSW
Molonglo R at Coppins Crossing,1.51pm Fri,1.75,rising,,Plot | Table,2022-10-14 15:50:02.540566+11:00,NSW
Molonglo R below Yarralumla Creek,3.42pm Fri,2.40,rising,,Plot | Table,2022-10-14 15:50:02.540566+11:00,NSW
Molonglo R at Sturt Island,1.00pm Fri,1.75,steady,,Plot | Table,2022-10-14 15:50:02.540566+11:00,NSW
Cooma Creek,Cooma Creek,Cooma Creek,Cooma Creek,Cooma Creek,Cooma Creek,2022-10-14 15:50:02.540566+11:00,NSW
Cooma Ck at Koolaroo,3.00pm Fri,0.92,steady,,Plot | Table,2022-10-14 15:50:02.540566+11:00,NSW
Cooma Back Ck at SMEC,3.01pm Fri,0.26,steady,,Plot | Table,2022-10-14 15:50:02.540566+11:00,NSW
Murrumbidgee River to Burrinjuck,Murrumbidgee River to Burrinjuck,Murrumbidgee River to Burrinjuck,Murrumbidgee River to Burrinjuck,Murrumbidgee River to Burrinjuck,Murrumbidgee River to Burrinjuck,2022-10-14 15:50:02.540566+11:00,NSW
Numeralla R at Numeralla,3.00pm Fri,0.83,steady,,Plot | Table,2022-10-14 15:50:02.540566+11:00,NSW
Alum Ck at Jones Plain Road,3.30pm Fri,0.86,steady,,Plot | Table,2022-10-14 15:50:02.540566+11:00,NSW
Murrumbidgee R at Mittagang Cross.,3.00pm Fri,1.23,steady,,Plot | Table,2022-10-14 15:50:02.540566+11:00,NSW
Murrumbidgee R at Billilingra,3.30pm Fri,1.82,steady,,Plot | Table,2022-10-14 15:50:02.540566+11:00,NSW
Bredbo R at Bredbo Station,3.00pm Fri,0.93,steady,,Plot | Table,2022-10-14 15:50:02.540566+11:00,NSW
Micaligo Ck at Michelago,3.00pm Fri,0.70,steady,,Plot | Table,2022-10-14 15:50:02.540566+11:00,NSW
Gudgenby R at Tennent,1.00pm Fri,2.19,steady,,Plot | Table,2022-10-14 15:50:02.540566+11:00,NSW
Murrumbidgee R at Lobbs Hole,1.00pm Fri,3.53,steady,below minor,Plot | Table,2022-10-14 15:50:02.540566+11:00,NSW
Tuggeranong Ck at Weir,7.01am Fri,0.22^,steady,,Plot | Table,2022-10-14 15:50:02.540566+11:00,NSW
Tuggeranong Ck u/s of Sewer,1.39pm Fri,0.68,falling,,Plot | Table,2022-10-14 15:50:02.540566+11:00,NSW
Cotter R at Cotter Dam,1.00pm Fri,551.15^,steady,,Plot | Table,2022-10-14 15:50:02.540566+11:00,NSW
Cotter R at Cotter Kiosk,1.00pm Fri,1.10,steady,,Plot | Table,2022-10-14 15:50:02.540566+11:00,NSW
Murrumbidgee R at Mt Macdonald,1.30am Fri,2.38,falling,below minor,Plot | Table,2022-10-14 15:50:02.540566+11:00,NSW
Ginninderra Ck U/S Barton Hwy,1.50pm Fri,1.16,rising,,Plot | Table,2022-10-14 15:50:02.540566+11:00,NSW
Ginninderra Ck U/S Charn. Rd,1.00pm Fri,0.77,steady,,Plot | Table,2022-10-14 15:50:02.540566+11:00,NSW
Murrumbidgee R at Halls,1.00pm Fri,3.77,steady,,Plot | Table,2022-10-14 15:50:02.540566+11:00,NSW
Yass R U/S Macks Reef Rd,3.00pm Fri,1.21,steady,,Plot | Table,2022-10-14 15:50:02.540566+11:00,NSW
Yass R at Gundaroo,3.00pm Fri,0.95,steady,,Plot | Table,2022-10-14 15:50:02.540566+11:00,NSW
Yass R at Yass,3.00pm Fri,0.99,steady,,Plot | Table,2022-10-14 15:50:02.540566+11:00,NSW
Yass R u/s Burrinjuck Dam,3.00pm Fri,2.23,steady,,Plot | Table,2022-10-14 15:50:02.540566+11:00,NSW
Goodradigbee R at Wee Jasper,3.00pm Fri,1.90,steady,,Plot | Table,2022-10-14 15:50:02.540566+11:00,NSW
Murrumbidgee R D/S Burrinjuck Dam,3.35pm Fri,3.97,steady,,Plot | Table,2022-10-14 15:50:02.540566+11:00,NSW
Tumut River,Tumut River,Tumut River,Tumut River,Tumut River,Tumut River,2022-10-14 15:50:02.540566+11:00,NSW
Tumut R at Oddys Bridge,3.30pm Fri,1.45,steady,,Plot | Table,2022-10-14 15:50:02.540566+11:00,NSW
Goobarragandra R at Lacmalac,3.30pm Fri,2.21,steady,,Plot | Table,2022-10-14 15:50:02.540566+11:00,NSW
Tumut R at Tumut,3.30pm Fri,1.27,steady,below minor,Plot | Table,2022-10-14 15:50:02.540566+11:00,NSW
Tumut R at Brungle Bridge,3.30pm Fri,2.42,rising,,Plot | Table,2022-10-14 15:50:02.540566+11:00,NSW
Murrumbidgee River to Gundagai,Murrumbidgee River to Gundagai,Murrumbidgee River to Gundagai,Murrumbidgee River to Gundagai,Murrumbidgee River to Gundagai,Murrumbidgee River to Gundagai,2022-10-14 15:50:02.540566+11:00,NSW
Murrumbidgee R at Glendale,3.15pm Fri,2.61,steady,,Plot | Table,2022-10-14 15:50:02.540566+11:00,NSW
Murrumbidgee R at Gobarralong,3.30pm Fri,4.66,steady,,Plot | Table,2022-10-14 15:50:02.540566+11:00,NSW
Adjungbilly R at Darbalara,3.00pm Fri,1.62,steady,,Plot | Table,2022-10-14 15:50:02.540566+11:00,NSW
Jindalee Ck at Jindalee,3.00pm Fri,0.59,steady,,Plot | Table,2022-10-14 15:50:02.540566+11:00,NSW
Jugiong Ck at Jugiong Creek,3.15pm Fri,1.85,steady,,Plot | Table,2022-10-14 15:50:02.540566+11:00,NSW
Muttama Ck at Berthong Rd,3.00pm Fri,1.10,steady,,Plot | Table,2022-10-14 15:50:02.540566+11:00,NSW
Muttama Ck at Coolac,3.30pm Fri,2.38,rising,,Plot | Table,2022-10-14 15:50:02.540566+11:00,NSW
Murrumbidgee R at Gundagai,3.30pm Fri,6.02,falling,below minor,Plot | Table,2022-10-14 15:50:02.540566+11:00,NSW
Murrumbidgee River to Wagga Wagga,Murrumbidgee River to Wagga Wagga,Murrumbidgee River to Wagga Wagga,Murrumbidgee River to Wagga Wagga,Murrumbidgee River to Wagga Wagga,Murrumbidgee River to Wagga Wagga,2022-10-14 15:50:02.540566+11:00,NSW
Adelong Ck at Batlow Road,3.30pm Fri,0.81,steady,,Plot | Table,2022-10-14 15:50:02.540566+11:00,NSW
Hillas Ck at Mt Adrah,3.30pm Fri,1.78,rising,,Plot | Table,2022-10-14 15:50:02.540566+11:00,NSW
Murrumbidgee R at Eringoarrah,3.30pm Fri,8.03,steady,,Plot | Table,2022-10-14 15:50:02.540566+11:00,NSW
Tarcutta Ck at Westbrook,3.20pm Fri,1.17,steady,,Plot | Table,2022-10-14 15:50:02.540566+11:00,NSW
Tarcutta Ck at Belmore Bridge,3.30pm Fri,2.05,falling,,Plot | Table,2022-10-14 15:50:02.540566+11:00,NSW
Tarcutta Ck at Old Borambola,3.00pm Fri,1.75,steady,,Plot | Table,2022-10-14 15:50:02.540566+11:00,NSW
Kyeamba Ck at Book Book,3.00pm Fri,2.32,falling,,Plot | Table,2022-10-14 15:50:02.540566+11:00,NSW
Kyeamba Ck at Ladysmith,3.00pm Fri,4.42,rising,,Plot | Table,2022-10-14 15:50:02.540566+11:00,NSW
Murrumbidgee R at Wagga Wagga,3.30pm Fri,8.88,steady,minor,Plot | Table,2022-10-14 15:50:02.540566+11:00,NSW
Mirrool Creek,Mirrool Creek,Mirrool Creek,Mirrool Creek,Mirrool Creek,Mirrool Creek,2022-10-14 15:50:02.540566+11:00,NSW
Mirrool Ck at Barellan Rd,3.00pm Fri,1.42,steady,,Plot | Table,2022-10-14 15:50:02.540566+11:00,NSW
Mirrool Ck at East Mirrool Reg,1.00pm Fri,0.98,rising,minor,Plot | Table,2022-10-14 15:50:02.540566+11:00,NSW
Lower Murrumbidgee River,Lower Murrumbidgee River,Lower Murrumbidgee River,Lower Murrumbidgee River,Lower Murrumbidgee River,Lower Murrumbidgee River,2022-10-14 15:50:02.540566+11:00,NSW
Beavers Ck at Mundowey,3.00pm Fri,6.82,falling,,Plot | Table,2022-10-14 15:50:02.540566+11:00,NSW
Murrumbidgee R at Berembed Weir,3.30pm Fri,7.12,steady,,Plot | Table,2022-10-14 15:50:02.540566+11:00,NSW
Murrumbidgee R at Narrandera,3.00pm Fri,7.26,steady,minor,Plot | Table,2022-10-14 15:50:02.540566+11:00,NSW
Murrumbidgee R at Gogeldrie Weir,2.47pm Fri,6.68,steady,,Plot | Table,2022-10-14 15:50:02.540566+11:00,NSW
Murrumbidgee R at Darlington Point,3.00pm Fri,6.22,steady,minor,Plot | Table,2022-10-14 15:50:02.540566+11:00,NSW
Murrumbidgee R D/S Hay Weir,2.47pm Fri,8.03,steady,minor,Plot | Table,2022-10-14 15:50:02.540566+11:00,NSW
Murrumbidgee R at Maude Weir,2.48pm Fri,6.93,steady,,Plot | Table,2022-10-14 15:50:02.540566+11:00,NSW
Murrumbidgee R D/S Maude Weir,3.00pm Fri,6.81,steady,,Plot | Table,2022-10-14 15:50:02.540566+11:00,NSW
Murrumbidgee R at Redbank Weir,2.47pm Fri,5.99,steady,,Plot | Table,2022-10-14 15:50:02.540566+11:00,NSW
Murrumbidgee R D/S Redbank Weir,2.47pm Fri,5.99,steady,,Plot | Table,2022-10-14 15:50:02.540566+11:00,NSW
Murrumbidgee R D/S Balranald Weir,3.00pm Fri,6.71,steady,minor,Plot | Table,2022-10-14 15:50:02.540566+11:00,NSW
Yanco Ck at Yanco Offtake,3.00pm Fri,4.92,rising,,Plot | Table,2022-10-14 15:50:02.540566+11:00,NSW
Murrumbidgee R D/S Yanco Weir,3.00pm Fri,6.63,steady,,Plot | Table,2022-10-14 15:50:02.540566+11:00,NSW
Yanco Ck at Yanco Br,3.00pm Fri,2.44,steady,,Plot | Table,2022-10-14 15:50:02.540566+11:00,NSW
Yanco Ck at Morundah,3.00pm Fri,2.95,steady,,Plot | Table,2022-10-14 15:50:02.540566+11:00,NSW
Colombo Ck at Morundah,3.00pm Fri,2.31,steady,,Plot | Table,2022-10-14 15:50:02.540566+11:00,NSW
Billabong Ck at Walbundrie,3.00pm Fri,2.62,rising,,Plot | Table,2022-10-14 15:50:02.540566+11:00,NSW
Billabong Ck at Jerilderie,3.00pm Fri,1.57,steady,,Plot | Table,2022-10-14 15:50:02.540566+11:00,NSW
Billabong Ck at Conargo,3.00pm Fri,3.58,steady,,Plot | Table,2022-10-14 15:50:02.540566+11:00,NSW
Forest Ck at Warriston Weir,3.00pm Fri,0.74,steady,,Plot | Table,2022-10-14 15:50:02.540566+11:00,NSW
Billabong Ck at Darlot,3.00pm Fri,4.79,steady,,Plot | Table,2022-10-14 15:50:02.540566+11:00,NSW
Niemur R at Mallan School,3.00pm Fri,6.21,steady,,Plot | Table,2022-10-14 15:50:02.540566+11:00,NSW
Murray River to Hume Dam,Murray River to Hume Dam,Murray River to Hume Dam,Murray River to Hume Dam,Murray River to Hume Dam,Murray River to Hume Dam,2022-10-14 15:50:02.540566+11:00,NSW
Murray R at Biggara,3.30pm Fri,1.51,steady,,Plot | Table,2022-10-14 15:50:02.540566+11:00,NSW
Murray R at Bringenbrong,3.30pm Fri,2.45,rising,,Plot | Table,2022-10-14 15:50:02.540566+11:00,NSW
Maragle Ck at Maragle,3.30pm Fri,0.97,falling,,Plot | Table,2022-10-14 15:50:02.540566+11:00,NSW
Tumbarumba Ck at Tumbarumba,3.30pm Fri,1.51,steady,,Plot | Table,2022-10-14 15:50:02.540566+11:00,NSW
Tumbarumba Ck at Bakers,3.30pm Fri,3.52,rising,,Plot | Table,2022-10-14 15:50:02.540566+11:00,NSW
Mannus Ck at Glenroy No.2,3.30pm Fri,2.17,steady,,Plot | Table,2022-10-14 15:50:02.540566+11:00,NSW
Mannus Ck at Yarramundi,3.30pm Fri,1.93,falling,,Plot | Table,2022-10-14 15:50:02.540566+11:00,NSW
Mannus Ck at Tooma,3.30pm Fri,1.39,rising,,Plot | Table,2022-10-14 15:50:02.540566+11:00,NSW
Welumba Ck at The Square,3.30pm Fri,0.75,steady,,Plot | Table,2022-10-14 15:50:02.540566+11:00,NSW
Tooma R at Pinegrove,3.30pm Fri,3.09,rising,,Plot | Table,2022-10-14 15:50:02.540566+11:00,NSW
Jingellic Ck at Jingellic,3.30pm Fri,2.31,steady,,Plot | Table,2022-10-14 15:50:02.540566+11:00,NSW
Murray R at Jingellic,3.00pm Fri,2.96,steady,below minor,Plot | Table,2022-10-14 15:50:02.540566+11:00,NSW
Gibbo Ck at Gibbo Park,3.00pm Fri,1.25,steady,,Plot | Table,2022-10-14 15:50:02.540566+11:00,NSW
Murray R at Hume Dam,3.30pm Fri,191.04,steady,,Plot | Table,2022-10-14 15:50:02.540566+11:00,NSW
Murray River to Tocumwal,Murray River to Tocumwal,Murray River to Tocumwal,Murray River to Tocumwal,Murray River to Tocumwal,Murray River to Tocumwal,2022-10-14 15:50:02.540566+11:00,NSW
Murray R at Heywoods,3.30pm Fri,3.92,steady,,Plot | Table,2022-10-14 15:50:02.540566+11:00,NSW
Murray R at Albury,3.30pm Fri,4.20,steady,below minor,Plot | Table,2022-10-14 15:50:02.540566+11:00,NSW
Murray R at Howlong,3.30pm Fri,5.71,steady,,Plot | Table,2022-10-14 15:50:02.540566+11:00,NSW
Murray R at Corowa,3.30pm Fri,5.98,steady,moderate,Plot | Table,2022-10-14 15:50:02.540566+11:00,NSW
Ovens R at Wangaratta,3.00pm Fri,12.04,rising,,Plot | Table,2022-10-14 15:50:02.540566+11:00,NSW
Murray R D/S Yarrawonga Weir,3.30pm Fri,5.79,steady,below minor,Plot | Table,2022-10-14 15:50:02.540566+11:00,NSW
Murray R at Tocumwal,3.00pm Fri,6.30,steady,below minor,Plot | Table,2022-10-14 15:50:02.540566+11:00,NSW
Lower Murray River,Lower Murray River,Lower Murray River,Lower Murray River,Lower Murray River,Lower Murray River,2022-10-14 15:50:02.540566+11:00,NSW
Murray R at Gulpa,3.00pm Fri,2.79,steady,,Plot | Table,2022-10-14 15:50:02.540566+11:00,NSW
Murray R at Barmah,3.00pm Fri,6.43,steady,,Plot | Table,2022-10-14 15:50:02.540566+11:00,NSW
Goulburn R at Shepparton,2.58pm Fri,9.56,steady,,Plot | Table,2022-10-14 15:50:02.540566+11:00,NSW
Goulburn R at Mc Coys Br,3.00pm Fri,8.37,steady,,Plot | Table,2022-10-14 15:50:02.540566+11:00,NSW
Murray R at Echuca Wharf,3.00pm Fri,93.13^,steady,below minor,Plot | Table,2022-10-14 15:50:02.540566+11:00,NSW
Campaspe R at Roch. Syphon,3.00pm Fri,9.25,rising,major,Plot | Table,2022-10-14 15:50:02.540566+11:00,NSW
Murray R at Pianta Road,3.00pm Fri,91.97^,steady,,Plot | Table,2022-10-14 15:50:02.540566+11:00,NSW
Murray R at Torrumbarry,3.00pm Fri,7.74,steady,moderate,Plot | Table,2022-10-14 15:50:02.540566+11:00,NSW
Murray R at Barham,3.00pm Fri,6.14,steady,major,Plot | Table,2022-10-14 15:50:02.540566+11:00,NSW
Little Merran Ck at Franklings,3.00pm Fri,3.87,steady,,Plot | Table,2022-10-14 15:50:02.540566+11:00,NSW
Edward R at Offtake,3.00pm Fri,3.07,steady,,Plot | Table,2022-10-14 15:50:02.540566+11:00,NSW
Gulpa Ck at Offtake,3.00pm Fri,3.54,steady,,Plot | Table,2022-10-14 15:50:02.540566+11:00,NSW
Edward R at Toonalook,3.00pm Fri,7.95,steady,,Plot | Table,2022-10-14 15:50:02.540566+11:00,NSW
Tuppal Ck at Aratula Rd,3.00pm Fri,5.71,steady,,Plot | Table,2022-10-14 15:50:02.540566+11:00,NSW
Mulwala Canal at Edward River Esc.,3.00pm Fri,0.65,steady,,Plot | Table,2022-10-14 15:50:02.540566+11:00,NSW
Edward R at Deniliquin,3.00pm Fri,6.50,steady,minor,Plot | Table,2022-10-14 15:50:02.540566+11:00,NSW
Wakool R at Offtake Reg.,3.00pm Fri,4.22,steady,,Plot | Table,2022-10-14 15:50:02.540566+11:00,NSW
Edward R D/S Stevens Weir,3.00pm Fri,6.24,steady,moderate,Plot | Table,2022-10-14 15:50:02.540566+11:00,NSW
Wakool R at Main Canal Offtake,3.00pm Fri,2.49,steady,,Plot | Table,2022-10-14 15:50:02.540566+11:00,NSW
Colligen Ck Below Regulator,3.00pm Fri,3.49,steady,,Plot | Table,2022-10-14 15:50:02.540566+11:00,NSW
Edward R at Moulamein,3.00pm Fri,4.99,steady,minor,Plot | Table,2022-10-14 15:50:02.540566+11:00,NSW
Edward R at Liewah,3.00pm Fri,5.96,steady,,Plot | Table,2022-10-14 15:50:02.540566+11:00,NSW
Wakool R at Stoney Crossing,3.00pm Fri,7.18,steady,,Plot | Table,2022-10-14 15:50:02.540566+11:00,NSW
Murray R at Boundary Bend,3.00pm Fri,7.96,steady,below minor,Plot | Table,2022-10-14 15:50:02.540566+11:00,NSW
Murray R D/S Euston Weir**,3.00pm Fri,49.24^,steady,below minor,Plot | Table,2022-10-14 15:50:02.540566+11:00,NSW
Murray R at Colignan,3.00pm Fri,6.97,steady,,Plot | Table,2022-10-14 15:50:02.540566+11:00,NSW
Murray R U/S Mildura Weir,1.00pm Fri,34.49,steady,below minor,Plot | Table,2022-10-14 15:50:02.540566+11:00,NSW
Murray R D/S Mildura Weir,3.00pm Fri,34.48^,falling,below minor,Plot | Table,2022-10-14 15:50:02.540566+11:00,NSW
Murray R at Wentworth Lock 10,3.00pm Fri,31.82,steady,below minor,Plot | Table,2022-10-14 15:50:02.540566+11:00,NSW
