Station Name,Time/Day,Height,Tendency,Crossing,Flood Class,Recent Data,Scraped,State
Torrens,Torrens,Torrens,Torrens,Torrens,Torrens,Torrens,2022-10-13 18:20:01.765230+11:00,SA
Torrens R at Mt Pleasant (DEW),5.10pm Thu,1.17,steady,0.17 above weir,,Plot | Table,2022-10-13 18:20:01.765230+11:00,SA
Torrens R at Mt Pleasant (SAW),5.30pm Thu,1.17,steady,0.17 above weir,,Plot | Table,2022-10-13 18:20:01.765230+11:00,SA
Angas Ck at Muellers Rd,3.18pm Thu,0.11,steady,,,Plot | Table,2022-10-13 18:20:01.765230+11:00,SA
Millers Ck at Forreston,5.35pm Thu,0.08,steady,,,Plot | Table,2022-10-13 18:20:01.765230+11:00,SA
Torrens R at Gumeracha Weir (SAW),5.30pm Thu,10.06,steady,0.06 above weir,below minor,Plot | Table,2022-10-13 18:20:01.765230+11:00,SA
Torrens R at Gumeracha Weir (BOM),1.20pm Thu,10.01,steady,0.01 above weir,below minor,Plot | Table,2022-10-13 18:20:01.765230+11:00,SA
Cudlee Ck at Lobethal Rd,3.58pm Thu,0.10,steady,0.10 above weir,,Plot | Table,2022-10-13 18:20:01.765230+11:00,SA
Millbrook Reservoir (SAW),5.30pm Thu,24.01,steady,1.39 below spillway,,Plot | Table,2022-10-13 18:20:01.765230+11:00,SA
Torrens R DS Hollands Ck (DEW),5.00pm Thu,1.26,steady,0.26 above weir,,Plot | Table,2022-10-13 18:20:01.765230+11:00,SA
Kangaroo Creek Resv Dam (SAW),5.30pm Thu,43.50,steady,0.70 below spillway,,Plot | Table,2022-10-13 18:20:01.765230+11:00,SA
Sixth Ck at Castambul,4.58pm Thu,0.25,steady,0.25 above weir,below minor,Plot | Table,2022-10-13 18:20:01.765230+11:00,SA
Torrens R at Gorge Weir,3.13pm Thu,9.10,steady,0.90 below weir,below minor,Plot | Table,2022-10-13 18:20:01.765230+11:00,SA
Torrens R at Gorge Weir (SAW),5.30pm Thu,9.12,steady,0.88 below weir,below minor,Plot | Table,2022-10-13 18:20:01.765230+11:00,SA
Fifth Ck at Athelstone,4.26pm Thu,0.27,steady,,below minor,Plot | Table,2022-10-13 18:20:01.765230+11:00,SA
Second Ck at Stonyfell,3.14pm Thu,0.08,steady,0.08 above weir,,Plot | Table,2022-10-13 18:20:01.765230+11:00,SA
Torrens R at Walkerville (DEW),5.05pm Thu,1.65,falling,,,Plot | Table,2022-10-13 18:20:01.765230+11:00,SA
First Ck at Waterfall Gully Rd,5.26pm Thu,0.43,steady,1.57 below bridge,below minor,Plot | Table,2022-10-13 18:20:01.765230+11:00,SA
First Ck at Botanic Gdns (DEW),5.05pm Thu,1.20,steady,0.20 above weir,,Plot | Table,2022-10-13 18:20:01.765230+11:00,SA
Torrens R at Holbrooks Rd (DEW),5.00pm Thu,1.61,rising,0.61 above weir,,Plot | Table,2022-10-13 18:20:01.765230+11:00,SA
Torrens R at Seaview Rd (DEW),5.00pm Thu,0.28,steady,,,Plot | Table,2022-10-13 18:20:01.765230+11:00,SA
Port Adelaide,Port Adelaide,Port Adelaide,Port Adelaide,Port Adelaide,Port Adelaide,Port Adelaide,2022-10-13 18:20:01.765230+11:00,SA
Dry Ck at Valley View (DEW),5.00pm Thu,1.23,steady,0.23 above weir,below minor,Plot | Table,2022-10-13 18:20:01.765230+11:00,SA
Dry Ck at Bridge Rd (DEW),4.50pm Thu,1.18,steady,3.82 below bridge,below minor,Plot | Table,2022-10-13 18:20:01.765230+11:00,SA
Little Para Reservoir (SAW),5.30pm Thu,12.29,steady,28.41 below spillway,,Plot | Table,2022-10-13 18:20:01.765230+11:00,SA
Little Para R US Fault (DEW),5.10pm Thu,1.44,steady,0.44 above weir,,Plot | Table,2022-10-13 18:20:01.765230+11:00,SA
Tide level at Pt Adelaide (Osborne),5.29pm Thu,2.33,rising,,below minor,Plot | Table,2022-10-13 18:20:01.765230+11:00,SA
Patawalonga,Patawalonga,Patawalonga,Patawalonga,Patawalonga,Patawalonga,Patawalonga,2022-10-13 18:20:01.765230+11:00,SA
Keswick Ck at Victoria Park,5.25pm Thu,0.13,falling,,,Plot | Table,2022-10-13 18:20:01.765230+11:00,SA
Keswick Ck at Unley (Roberts Place),5.30pm Thu,0.18,steady,,below minor,Plot | Table,2022-10-13 18:20:01.765230+11:00,SA
Keswick Ck at Army Barracks,5.33pm Thu,0.43,falling,2.07 below bridge,below minor,Plot | Table,2022-10-13 18:20:01.765230+11:00,SA
Brownhill Ck at Mitcham (DEW),5.05pm Thu,1.16,steady,0.16 above weir,,Plot | Table,2022-10-13 18:20:01.765230+11:00,SA
Brownhill Ck at Heywood Park,5.35pm Thu,0.10,falling,,,Plot | Table,2022-10-13 18:20:01.765230+11:00,SA
Brownhill Ck at Adelaide Ap (DEW),5.10pm Thu,0.17,steady,3.33 below bridge,,Plot | Table,2022-10-13 18:20:01.765230+11:00,SA
Sturt Ck at Coromandel Valley,3.46pm Thu,0.17,steady,,below minor,Plot | Table,2022-10-13 18:20:01.765230+11:00,SA
Sturt Ck DS Minno Ck (DEW),5.05pm Thu,1.18,steady,0.18 above weir,,Plot | Table,2022-10-13 18:20:01.765230+11:00,SA
Sturt Ck at Sturt Dam,5.09pm Thu,0.14,falling,23.91 below spillway,below minor,Plot | Table,2022-10-13 18:20:01.765230+11:00,SA
Sturt Ck at Marion (Marion Rd),5.22pm Thu,0.25,falling,,below minor,Plot | Table,2022-10-13 18:20:01.765230+11:00,SA
Sturt Ck at Novar Gardens (DEW),4.50pm Thu,1.25,steady,0.19 above weir,,Plot | Table,2022-10-13 18:20:01.765230+11:00,SA
